{
  "$schema": "http://json-schema.org/draft-07/schema#",
  "title": "Item",
  "type": "object",
  "required": ["id", "name", "type"],
  "properties": {
    "id": { "type": "string" },
    "name": { "type": "string" },
    "type": {
      "type": "string",
      "enum": ["consumable", "equipment", "key", "quest"]
    },
    "description": { "type": "string" },
    "effects": {
      "type": "array",
      "items": {
        "type": "object",
        "required": ["stat", "amount"],
        "properties": {
          "stat": { "type": "string" },
          "amount": { "type": "integer" }
        }
      }
    }
  }
}